{
  "schemaVersion": 1,
  "projectId": "ium-lernwerk",
  "generatedAt": "2026-09-03",
  "inventoryPath": "roadmap/v2/foundations/sources/inventory.json",
  "policy": {
    "requiredFailure": "block-and-preserve-last-snapshot",
    "optionalFailure": "warn-and-write",
    "acceptedStatuses": [
      "resolved",
      "restricted"
    ]
  },
  "summary": {
    "total": 69,
    "required": 68,
    "optional": 1,
    "resolved": 46,
    "restricted": 23,
    "missing": 0,
    "unresolved": 0,
    "warnings": 0
  },
  "checks": [
    {
      "sourceId": "SRC-CUR-BMB-2016",
      "required": true,
      "locatorType": "url",
      "url": "https://www.bildungsplaene-bw.de/%2CLde/LS/BP2016BW/ALLG/GYM/BMB",
      "status": "resolved",
      "httpStatus": 200,
      "finalUrl": "https://www.bildungsplaene-bw.de/%2CLde/LS/BP2016BW/ALLG/GYM/BMB",
      "checkedAt": "2026-09-03"
    },
    {
      "sourceId": "SRC-CUR-INF7-2016",
      "required": true,
      "locatorType": "url",
      "url": "https://www.bildungsplaene-bw.de/%2CLde/LS/BP2016BW/ALLG/GYM/INF7",
      "status": "resolved",
      "httpStatus": 200,
      "finalUrl": "https://www.bildungsplaene-bw.de/%2CLde/LS/BP2016BW/ALLG/GYM/INF7",
      "checkedAt": "2026-09-03"
    },
    {
      "sourceId": "SRC-CUR-KM-FACHSEITE",
      "required": true,
      "locatorType": "url",
      "url": "https://km.baden-wuerttemberg.de/de/schule/schulartuebergreifend/mint/schule-und-unterricht/informatik-und-medienbildung",
      "status": "resolved",
      "httpStatus": 200,
      "finalUrl": "https://km.baden-wuerttemberg.de/de/schule/schulartuebergreifend/mint/schule-und-unterricht/informatik-und-medienbildung",
      "checkedAt": "2026-09-03"
    },
    {
      "sourceId": "SRC-CUR-KM-FAQ-REFORM",
      "required": true,
      "locatorType": "url",
      "url": "https://km.baden-wuerttemberg.de/de/schule/schulartuebergreifend/faq-bildungsreform",
      "status": "resolved",
      "httpStatus": 200,
      "finalUrl": "https://km.baden-wuerttemberg.de/de/schule/schulartuebergreifend/faq-bildungsreform",
      "checkedAt": "2026-09-03"
    },
    {
      "sourceId": "SRC-CUR-LESEHILFE-2026-27",
      "required": true,
      "locatorType": "v2-override",
      "url": "https://km.baden-wuerttemberg.de/fileadmin/redaktion/m-km/intern/PDF/Dateien/Schulart%C3%BCbergreifend/MINT/2026_Lesehilfe_IuM_Gym_und_Sek_I_bf.pdf",
      "status": "resolved",
      "httpStatus": 200,
      "finalUrl": "https://km.baden-wuerttemberg.de/fileadmin/redaktion/m-km/intern/PDF/Dateien/Schulart%C3%BCbergreifend/MINT/2026_Lesehilfe_IuM_Gym_und_Sek_I_bf.pdf",
      "checkedAt": "2026-09-03"
    },
    {
      "sourceId": "SRC-DLE-APP-MANIFEST-2026",
      "required": true,
      "locatorType": "url",
      "url": "https://www.w3.org/TR/2026/WD-appmanifest-20260723/",
      "status": "resolved",
      "httpStatus": 200,
      "finalUrl": "https://www.w3.org/TR/2026/WD-appmanifest-20260723/",
      "checkedAt": "2026-09-03"
    },
    {
      "sourceId": "SRC-DLE-APPLE-RESTRICTIONS-2026",
      "required": true,
      "locatorType": "url",
      "url": "https://developer.apple.com/documentation/devicemanagement/restrictions",
      "status": "resolved",
      "httpStatus": 200,
      "finalUrl": "https://developer.apple.com/documentation/devicemanagement/restrictions",
      "checkedAt": "2026-09-03"
    },
    {
      "sourceId": "SRC-DLE-APPLE-WEBFILTER-2026",
      "required": true,
      "locatorType": "url",
      "url": "https://developer.apple.com/documentation/devicemanagement/webcontentfilter",
      "status": "resolved",
      "httpStatus": 200,
      "finalUrl": "https://developer.apple.com/documentation/devicemanagement/webcontentfilter",
      "checkedAt": "2026-09-03"
    },
    {
      "sourceId": "SRC-DLE-CC-BY-4",
      "required": true,
      "locatorType": "url",
      "url": "https://creativecommons.org/licenses/by/4.0/legalcode.en",
      "status": "resolved",
      "httpStatus": 200,
      "finalUrl": "https://creativecommons.org/licenses/by/4.0/legalcode.en",
      "checkedAt": "2026-09-03"
    },
    {
      "sourceId": "SRC-DLE-CC-BY-SA-4",
      "required": true,
      "locatorType": "url",
      "url": "https://creativecommons.org/licenses/by-sa/4.0/legalcode.en",
      "status": "resolved",
      "httpStatus": 200,
      "finalUrl": "https://creativecommons.org/licenses/by-sa/4.0/legalcode.en",
      "checkedAt": "2026-09-03"
    },
    {
      "sourceId": "SRC-DLE-CC-COMPAT-2026",
      "required": true,
      "locatorType": "url",
      "url": "https://creativecommons.org/compatible-licenses/",
      "status": "resolved",
      "httpStatus": 200,
      "finalUrl": "https://creativecommons.org/compatible-licenses/",
      "checkedAt": "2026-09-03"
    },
    {
      "sourceId": "SRC-DLE-EDPB-DPBDD-2020",
      "required": true,
      "locatorType": "url",
      "url": "https://www.edpb.europa.eu/documents/guideline/guidelines-42019-on-article-25-data-protection-by-design-and-by-default_en",
      "status": "resolved",
      "httpStatus": 200,
      "finalUrl": "https://www.edpb.europa.eu/documents/guideline/guidelines-42019-on-article-25-data-protection-by-design-and-by-default_en",
      "checkedAt": "2026-09-03"
    },
    {
      "sourceId": "SRC-DLE-GDPR-2016",
      "required": true,
      "locatorType": "url",
      "url": "https://eur-lex.europa.eu/eli/reg/2016/679/oj",
      "status": "resolved",
      "httpStatus": 202,
      "finalUrl": "https://eur-lex.europa.eu/eli/reg/2016/679/oj",
      "checkedAt": "2026-09-03"
    },
    {
      "sourceId": "SRC-DLE-HTTP-CACHE-2022",
      "required": true,
      "locatorType": "url",
      "url": "https://www.rfc-editor.org/rfc/rfc9111.html",
      "status": "resolved",
      "httpStatus": 200,
      "finalUrl": "https://www.rfc-editor.org/rfc/rfc9111.html",
      "checkedAt": "2026-09-03"
    },
    {
      "sourceId": "SRC-DLE-IPAD-REVIEW-2021",
      "required": true,
      "locatorType": "doi",
      "url": "https://doi.org/10.1007/s13384-020-00400-0",
      "status": "resolved",
      "httpStatus": 200,
      "finalUrl": "https://link.springer.com/article/10.1007/s13384-020-00400-0",
      "checkedAt": "2026-09-03"
    },
    {
      "sourceId": "SRC-DLE-SERVICE-WORKERS-2026",
      "required": true,
      "locatorType": "url",
      "url": "https://www.w3.org/TR/2026/CRD-service-workers-20260723/",
      "status": "resolved",
      "httpStatus": 200,
      "finalUrl": "https://www.w3.org/TR/2026/CRD-service-workers-20260723/",
      "checkedAt": "2026-09-03"
    },
    {
      "sourceId": "SRC-DLE-TDDDG-25-2024",
      "required": true,
      "locatorType": "url",
      "url": "https://www.gesetze-im-internet.de/ttdsg/__25.html",
      "status": "resolved",
      "httpStatus": 200,
      "finalUrl": "https://www.gesetze-im-internet.de/ttdsg/__25.html",
      "checkedAt": "2026-09-03"
    },
    {
      "sourceId": "SRC-DLE-UNESCO-OER-2019",
      "required": true,
      "locatorType": "url",
      "url": "https://www.unesco.org/en/legal-affairs/recommendation-open-educational-resources-oer",
      "status": "resolved",
      "httpStatus": 200,
      "finalUrl": "https://www.unesco.org/en/legal-affairs/recommendation-open-educational-resources-oer",
      "checkedAt": "2026-09-03"
    },
    {
      "sourceId": "SRC-DLE-WAI-USERS-2020",
      "required": true,
      "locatorType": "url",
      "url": "https://www.w3.org/WAI/planning/involving-users/",
      "status": "resolved",
      "httpStatus": 200,
      "finalUrl": "https://www.w3.org/WAI/planning/involving-users/",
      "checkedAt": "2026-09-03"
    },
    {
      "sourceId": "SRC-DLE-WCAG22-2024",
      "required": true,
      "locatorType": "url",
      "url": "https://www.w3.org/TR/WCAG22/",
      "status": "resolved",
      "httpStatus": 200,
      "finalUrl": "https://www.w3.org/TR/WCAG22/",
      "checkedAt": "2026-09-03"
    },
    {
      "sourceId": "SRC-DLE-WHATWG-HTML-STORAGE-2026",
      "required": true,
      "locatorType": "url",
      "url": "https://html.spec.whatwg.org/multipage/webstorage.html",
      "status": "resolved",
      "httpStatus": 200,
      "finalUrl": "https://html.spec.whatwg.org/multipage/webstorage.html",
      "checkedAt": "2026-09-03"
    },
    {
      "sourceId": "SRC-DLE-WHATWG-STORAGE-2026",
      "required": true,
      "locatorType": "url",
      "url": "https://storage.spec.whatwg.org/",
      "status": "resolved",
      "httpStatus": 200,
      "finalUrl": "https://storage.spec.whatwg.org/",
      "checkedAt": "2026-09-03"
    },
    {
      "sourceId": "SRC-DLE-WSG-DRAFT-2026",
      "required": true,
      "locatorType": "url",
      "url": "https://www.w3.org/TR/2026/DNOTE-web-sustainability-guidelines-20260728/",
      "status": "resolved",
      "httpStatus": 200,
      "finalUrl": "https://www.w3.org/TR/2026/DNOTE-web-sustainability-guidelines-20260728/",
      "checkedAt": "2026-09-03"
    },
    {
      "sourceId": "SRC-INF-BLOCK-TEXT-2017",
      "required": true,
      "locatorType": "doi",
      "url": "https://doi.org/10.1145/3089799",
      "status": "restricted",
      "httpStatus": 403,
      "finalUrl": "https://dl.acm.org/doi/10.1145/3089799",
      "checkedAt": "2026-09-03"
    },
    {
      "sourceId": "SRC-INF-BLOCK-TEXT-TRANSFER-2019",
      "required": true,
      "locatorType": "doi",
      "url": "https://doi.org/10.1016/j.compedu.2019.103646",
      "status": "resolved",
      "httpStatus": 200,
      "finalUrl": "https://linkinghub.elsevier.com/retrieve/pii/S036013151930199X",
      "checkedAt": "2026-09-03"
    },
    {
      "sourceId": "SRC-INF-CSTA-2026",
      "required": true,
      "locatorType": "doi",
      "url": "https://doi.org/10.1145/3820482",
      "status": "restricted",
      "httpStatus": 403,
      "finalUrl": "https://dl.acm.org/doi/book/10.1145/3820482",
      "checkedAt": "2026-09-03"
    },
    {
      "sourceId": "SRC-INF-INTERNET-CONCEPTIONS-2023",